A1: 序号 | B1: 队名 | C1: 1 | D1: 2 | E1: 3 | F1: 4 | G1: 5 | H1: 6 | I1: 7 | J1: 8 | K1: 积分 | L1: 总局分 | M1: 小分 | N1: 1台得分 | O1: 2台得分 | P1: 3台得分 | Q1: 名次
C2: 炫飞女队 | D2: 聚贤天下 | E2: 石家庄 | F2: 精五门 | G2: 神话 | H2: ★棋心愉悦★女队 | I2: 湖北省棋牌运动管理中心
A3: 1 | B3: 炫飞女队 | D3: 1 | E3: 1 | F3: 1 | G3: 1 | H3: 0 | I3: 1 | K3: =SUM(D3:J3) -> 5 | L3: =N3+O3+P3 -> 12.5 | N3: 5 | O3: 4 | P3: 3.5 | Q3: 3
A4: 2 | B4: 聚贤天下 | C4: 0 | E4: 1 | F4: 0 | G4: 0 | H4: 0 | I4: 0 | K4: =SUM(D4:J4) -> 1 | L4: =N4+O4+P4 -> 6.5 | N4: 1.5 | O4: 1 | P4: 4 | Q4: 6
A5: 3 | B5: 石家庄 | C5: 0 | D5: 0 | F5: 0 | G5: 0 | H5: 0 | I5: 0 | K5: =SUM(D5:J5) -> 0 | L5: =N5+O5+P5 -> 3 | N5: 3 | O5: 0 | P5: 0 | Q5: 7
A6: 4 | B6: 精五门 | C6: 0 | D6: 1 | E6: 1 | G6: 1 | H6: 0 | I6: 0 | K6: =SUM(D6:J6) -> 3 | L6: =N6+O6+P6 -> 9 | N6: 1 | O6: 5 | P6: 3 | Q6: 4
A7: 5 | B7: 神话 | C7: 0 | D7: 1 | E7: 1 | F7: 0 | H7: 0 | I7: 0 | K7: =SUM(D7:J7) -> 2 | L7: =N7+O7+P7 -> 5 | N7: 1 | O7: 2 | P7: 2 | Q7: 5
A8: 6 | B8: ★棋心愉悦★女队 | C8: 1 | D8: 1 | E8: 1 | F8: 1 | G8: 1 | I8: 0 | K8: =SUM(C8:J8) -> 5 | L8: =N8+O8+P8 -> 13 | N8: 4.5 | O8: 4.5 | P8: 4 | Q8: 2
A9: 7 | B9: 湖北省棋牌运动管理中心 | C9: 0 | D9: 1 | E9: 1 | F9: 1 | G9: 1 | H9: 1 | K9: =SUM(D9:J9) -> 5 | L9: =N9+O9+P9 -> 14 | N9: 5 | O9: 4.5 | P9: 4.5 | Q9: 1
A10: 8 | K10: =SUM(D10:J10) -> 0 | L10: =N10+O10+P10 -> 0 | N10: 0 | O10: 0 | P10: 0