A1: 序号 | B1: 队名 | C1: 1 | D1: 2 | E1: 3 | F1: 4 | G1: 5 | H1: 6 | I1: 7 | J1: 8 | K1: 积分 | L1: 总局分 | M1: 小分 | N1: 1台得分 | O1: 2台得分 | P1: 3台得分 | Q1: 名次
C2: 圣棋盟棋社(首都师范大学) | D2: 秦皇岛高校联队1队 | E2: 秦皇岛高校联队2队 | F2: 武汉高校联队 | G2: 秦皇岛燕山大学代表队1队 | H2: 安徽新华学院 | I2: 华北电力大学（保定）
A3: 1 | B3: 圣棋盟棋社(首都师范大学) | D3: 1 | E3: 1 | K3: =SUM(C3:J3) -> 2 | L3: =N3+O3+P3 -> 6 | N3: 2 | O3: 2 | P3: 2
A4: 2 | B4: 秦皇岛高校联队1队 | C4: 0 | I4: 0 | K4: =SUM(C4:J4) -> 0 | L4: =N4+O4+P4 -> 1 | N4: 0 | O4: 0 | P4: 1
A5: 3 | B5: 秦皇岛高校联队2队 | C5: 0 | H5: 0 | I5: 0 | K5: =SUM(C5:J5) -> 0 | L5: =N5+O5+P5 -> 0 | N5: 0 | O5: 0 | P5: 0
A6: 4 | B6: 武汉高校联队 | G6: 1 | H6: 0.5 | I6: 1 | K6: =SUM(C6:J6) -> 2.5 | L6: =N6+O6+P6 -> 6.5 | N6: 1.5 | O6: 2 | P6: 3
A7: 5 | B7: 秦皇岛燕山大学代表队1队 | F7: 0 | H7: 0 | K7: =SUM(C7:J7) -> 0 | L7: =N7+O7+P7 -> 0 | N7: 0 | O7: 0 | P7: 0
A8: 6 | B8: 安徽新华学院 | E8: 1 | F8: 0.5 | G8: 1 | K8: =SUM(C8:J8) -> 2.5 | L8: =N8+O8+P8 -> 7.5 | N8: 2.5 | O8: 3 | P8: 2
A9: 7 | B9: 华北电力大学（保定） | D9: 1 | E9: 1 | F9: 0 | K9: =SUM(C9:J9) -> 2 | L9: =N9+O9+P9 -> 6 | N9: 3 | O9: 2 | P9: 1
A10: 8 | K10: =SUM(D10:J10) -> 0 | L10: =N10+O10+P10 -> 0 | N10: 0 | O10: 0 | P10: 0