A1: 序号 | B1: 队名 | C1: 1 | D1: 2 | E1: 3 | F1: 4 | G1: 5 | H1: 6 | I1: 7 | J1: 8 | K1: 积分 | L1: 总局分 | M1: 小分 | N1: 1台得分 | O1: 2台得分 | P1: 3台得分 | Q1: 名次
C2: 圣棋盟棋社(首都师范大学) | D2: 秦皇岛高校联队1队 | E2: 秦皇岛高校联队2队 | F2: 武汉高校联队 | G2: 秦皇岛燕山大学代表队1队 | H2: 安徽新华学院 | I2: 华北电力大学（保定）
A3: 1 | B3: 圣棋盟棋社(首都师范大学) | D3: 1 | E3: 1 | F3: 1 | G3: 1 | H3: 0 | I3: 1 | K3: =SUM(C3:J3) -> 5 | L3: =N3+O3+P3 -> 14 | N3: 4 | O3: 6 | P3: 4 | Q3: 1
A4: 2 | B4: 秦皇岛高校联队1队 | C4: 0 | E4: 0 | F4: 0 | G4: 1 | H4: 0 | I4: 0 | K4: =SUM(C4:J4) -> 1 | L4: =N4+O4+P4 -> 4 | N4: 1 | O4: 1 | P4: 2 | Q4: 6
A5: 3 | B5: 秦皇岛高校联队2队 | C5: 0 | D5: 1 | F5: 0 | G5: 1 | H5: 0 | I5: 0 | K5: =SUM(C5:J5) -> 2 | L5: =N5+O5+P5 -> 5 | N5: 2 | O5: 2 | P5: 1 | Q5: 5
A6: 4 | B6: 武汉高校联队 | C6: 0 | D6: 1 | E6: 1 | G6: 1 | H6: 0.5 | I6: 1 | K6: =SUM(C6:J6) -> 4.5 | L6: =N6+O6+P6 -> 13.5 | M6: 9.25 | N6: 3.5 | O6: 4 | P6: 6 | Q6: 3
A7: 5 | B7: 秦皇岛燕山大学代表队1队 | C7: 0 | D7: 0 | E7: 0 | F7: 0 | H7: 0 | I7: 0 | K7: =SUM(C7:J7) -> 0 | L7: =N7+O7+P7 -> 1 | N7: 0 | O7: 0 | P7: 1 | Q7: 7
A8: 6 | B8: 安徽新华学院 | C8: 1 | D8: 1 | E8: 1 | F8: 0.5 | G8: 1 | I8: 0 | K8: =SUM(C8:J8) -> 4.5 | L8: =N8+O8+P8 -> 13.5 | M8: 10.25 | N8: 4.5 | O8: 4 | P8: 5 | Q8: 2
A9: 7 | B9: 华北电力大学（保定） | C9: 0 | D9: 1 | E9: 1 | F9: 0 | G9: 1 | H9: 1 | K9: =SUM(C9:J9) -> 4 | L9: =N9+O9+P9 -> 12 | N9: 6 | O9: 4 | P9: 2 | Q9: 4
A10: 8 | K10: =SUM(D10:J10) -> 0 | L10: =N10+O10+P10 -> 0 | N10: 0 | O10: 0 | P10: 0