A1: 2007—2014年六届全国少年儿童五子棋锦标赛地区奖牌榜
A2: 地区 | B2: 金牌 | C2: 银牌 | D2: 铜牌 | E2: 合计
A3: 浙江 | B3: 11 | C3: 14 | D3: 16 | E3: =SUM(B3:D3) -> 41
A4: 江苏 | B4: 11 | C4: 12 | D4: 12 | E4: =SUM(B4:D4) -> 35
A5: 北京 | B5: 6 | C5: 1 | D5: 2 | E5: =SUM(B5:D5) -> 9
A6: 上海 | B6: 4 | C6: 5 | D6: 3 | E6: =SUM(B6:D6) -> 12
A7: 河北 | B7: 4 | C7: 0 | D7: 1 | E7: =SUM(B7:D7) -> 5
A8: 四川 | B8: 1 | C8: 0 | D8: 0 | E8: =SUM(B8:D8) -> 1
A9: 河南 | B9: 1 | C9: 0 | D9: 0 | E9: =SUM(B9:D9) -> 1
A10: 安徽 | B10: 0 | C10: 3 | D10: 0 | E10: =SUM(B10:D10) -> 3
A11: 湖北 | B11: 0 | C11: 2 | D11: 1 | E11: =SUM(B11:D11) -> 3
A12: 辽宁 | B12: 0 | C12: 1 | D12: 1 | E12: =SUM(B12:D12) -> 2
A13: 云南 | B13: 0 | C13: 0 | D13: 1 | E13: =SUM(B13:D13) -> 1
A14: 湖南 | B14: 0 | C14: 0 | D14: 1 | E14: =SUM(B14:D14) -> 1
A15: 合计 | B15: =SUM(B3:B14) -> 38 | C15: =SUM(C3:C14) -> 38 | D15: =SUM(D3:D14) -> 38 | E15: =SUM(E3:E14) -> 114