B2: 编号 | C2: 队伍 | D2: 已赛 | E2: 场胜 | F2: 场负 | G2: 场平 | H2: 局胜 | I2: 局负 | J2: 局平 | K2: 大分 | L2: 小分 | M2: 局分
B3: 4 | C3: 悠哉阁 | D3: =SUM(E3:G3) -> 5 | E3: 5 | F3: 0 | G3: 0 | H3: 16 | I3: 0 | J3: 0 | K3: 5 | L3: 16 | M3: 16
B4: 2 | C4: 五子菁英 | D4: =SUM(E4:G4) -> 5 | E4: 4 | F4: 0 | G4: 1 | H4: 13 | I4: 3 | J4: 0 | K4: 4.5 | L4: 13 | M4: 13
B5: 1 | C5: 圣棋盟 | D5: =SUM(E5:G5) -> 5 | E5: 3 | F5: 0 | G5: 2 | H5: 15 | I5: 5 | J5: 0 | K5: 4 | L5: 15 | M5: 15
B6: 9 | C6: 皇朝 | D6: =SUM(E6:G6) -> 5 | E6: 4 | F6: 1 | G6: 0 | H6: 15 | I6: 5 | J6: 0 | K6: 4 | L6: 15 | M6: 15
B7: 6 | C7: 讲五堂 | D7: =SUM(E7:G7) -> 5 | E7: 4 | F7: 1 | G7: 0 | H7: 11 | I7: 5 | J7: 0 | K7: 4 | L7: 11 | M7: 11
B8: 10 | C8: 神话 | D8: =SUM(E8:G8) -> 5 | E8: 3 | F8: 2 | G8: 0 | H8: 10 | I8: 10 | J8: 0 | K8: 3 | L8: 10 | M8: 10
B9: 12 | C9: 江湖英雄 | D9: =SUM(E9:G9) -> 5 | E9: 3 | F9: 2 | G9: 0 | H9: 6 | I9: 10 | J9: 0 | K9: 3 | L9: 6 | M9: 6
B10: 3 | C10: 红细胞 | D10: =SUM(E10:G10) -> 5 | E10: 2 | F10: 2 | G10: 1 | H10: 9 | I10: 11 | J10: 0 | K10: 2.5 | L10: 9 | M10: 9
B11: 11 | C11: 华电 | D11: =SUM(E11:G11) -> 5 | E11: 1 | F11: 3 | G11: 1 | H11: 9 | I11: 11 | J11: 0 | K11: 1.5 | L11: 9 | M11: 9
B12: 8 | C12: 弈星 | D12: =SUM(E12:G12) -> 5 | E12: 1 | F12: 3 | G12: 1 | H12: 7 | I12: 13 | J12: 0 | K12: 1.5 | L12: 7 | M12: 7
B13: 5 | C13: 风云 | D13: =SUM(E13:G13) -> 5 | E13: 1 | F13: 4 | G13: 0 | H13: 5 | I13: 15 | J13: 0 | K13: 1 | L13: 5 | M13: 5
B14: 13 | C14: 创世纪 | D14: =SUM(E14:G14) -> 5 | E14: 1 | F14: 4 | G14: 0 | H14: 2 | I14: 14 | J14: 0 | K14: 1 | L14: 2 | M14: 2
B15: 7 | C15: 圣鑫 | D15: =SUM(E15:G15) -> 5 | E15: 0 | F15: 5 | G15: 0 | H15: 2 | I15: 18 | J15: 0 | K15: 0 | L15: 2 | M15: 2
A17: 排名方法 ①采用积分制：胜 1 分 , 和棋各 0.5 分 , 输 0 分； ②大分相同者 , 比较小分；小分相同再比较局分； 大分计算方法：团队每轮得分之和 小分计算方法为：全队队员得分之和 局分计算方法为：全队队员胜局数。 ——解释权归大赛组委会所有 暑假杯五子棋家族争霸赛轶序册 /ziyou/HTML/4151.html 星火道场初级群：169143174