A1: 南通首届高校五子棋邀请赛决赛
B2: 丁保宽（航） | C2: 朱泳树（通） | D2: 陈鹏（航） | E2: 胡超（紫） | F2: 缪知江（职） | G2: 徐菁琳（通） | H2: 相岩（农） | I2: 徐健澄（紫） | J2: 积分 | K2: 名次
A3: 丁保宽（航） | C3: 1 | D3: 0 | E3: 1 | F3: 1 | G3: 1 | H3: 1 | I3: 1 | J3: =SUM(B3:I3) -> 6 | K3: 1
A4: 朱泳树（通） | B4: 0 | D4: 0 | E4: 0 | F4: 1 | G4: 0 | H4: 1 | I4: 1 | J4: =SUM(B4:I4) -> 3 | K4: 6
A5: 陈鹏（航） | B5: 1 | C5: 1 | E5: 0 | F5: 0 | G5: 0 | H5: 1 | I5: 1 | J5: =SUM(B5:I5) -> 4 | K5: 4
A6: 胡超（紫） | B6: 0 | C6: 1 | D6: 1 | F6: 0 | G6: 0 | H6: 1 | I6: 1 | J6: =SUM(B6:I6) -> 4 | K6: 3
A7: 缪知江（职） | B7: 0 | C7: 0 | D7: 1 | E7: 1 | G7: 1 | H7: 0 | I7: 0 | J7: =SUM(B7:I7) -> 3 | K7: 5
A8: 徐菁琳（通） | B8: 0 | C8: 1 | D8: 1 | E8: 1 | F8: 0 | H8: 1 | I8: 1 | J8: =SUM(B8:I8) -> 5 | K8: 2
A9: 相岩（农） | B9: 0 | C9: 0 | D9: 0 | E9: 0 | F9: 1 | G9: 0 | I9: 1 | J9: =SUM(B9:I9) -> 2 | K9: 7
A10: 徐健澄（紫） | B10: 0 | C10: 0 | D10: 0 | E10: 0 | F10: 0 | G10: 1 | H10: 0 | J10: =SUM(B10:I10) -> 1 | K10: 8